[
  {
    "schema_version": "1.0",
    "kind": "wawalu.integration.identity",
    "export_id": "20000000-0000-4000-8000-000000000004",
    "snapshot": { "source_instance_id": "psn_idp_demo_000000001", "sequence": 94, "generated_at": "2026-07-25T12:30:00Z", "mode": "delta", "completeness": "complete", "omitted_record_count": 0, "issues": [] },
    "privacy": { "identifier_method": "hmac-sha256-truncated", "direct_identifiers_included": false, "salt_scope": "tenant-integration-v1" },
    "records": [{ "subject_id": "psn_subject_demo_00001", "revision": 9, "operation": "upsert", "effective_at": "2026-07-25T12:29:00Z", "org_unit_ids": ["psn_unit_demo_00000002"], "account_state": "disabled", "access_tier": "member" }]
  },
  {
    "schema_version": "1.0",
    "kind": "wawalu.integration.identity",
    "export_id": "20000000-0000-4000-8000-000000000005",
    "snapshot": { "source_instance_id": "psn_idp_demo_000000001", "sequence": 93, "generated_at": "2026-07-25T12:35:00Z", "mode": "delta", "completeness": "complete", "omitted_record_count": 0, "issues": [] },
    "privacy": { "identifier_method": "hmac-sha256-truncated", "direct_identifiers_included": false, "salt_scope": "tenant-integration-v1" },
    "records": [{ "subject_id": "psn_subject_demo_00001", "revision": 8, "operation": "upsert", "effective_at": "2026-07-25T12:20:00Z", "org_unit_ids": ["psn_unit_demo_00000002"], "account_state": "active", "access_tier": "manager" }]
  }
]
