{
  "schema_version": "1.0",
  "kind": "wawalu.integration.identity",
  "export_id": "20000000-0000-4000-8000-000000000002",
  "snapshot": { "source_instance_id": "psn_idp_demo_000000001", "sequence": 92, "generated_at": "2026-07-25T12:15:00Z", "mode": "full", "completeness": "partial", "omitted_record_count": 4, "issues": [{ "code": "record_redacted", "scope": "record", "retryable": false }] },
  "privacy": { "identifier_method": "hmac-sha256-truncated", "direct_identifiers_included": false, "salt_scope": "tenant-integration-v1" },
  "records": []
}
